{
  "$schema": "https://json-schema.org/draft/2020-12/schema",
  "$id": "https://cepraea.local/schemas/schema_termo.json",
  "title": "Registro de termo do glossário (glossario.md) — só significado, não modelo conceitual",
  "type": "object",
  "required": [
    "id_termo",
    "termo_preferencial",
    "nome_canonico",
    "classificacao",
    "definicao",
    "fonte",
    "estado_epistemologico",
    "estado_tecnico",
    "evidencia"
  ],
  "properties": {
    "id_termo": {
      "type": "string",
      "pattern": "^TERMO-[0-9]{3}$"
    },
    "termo_preferencial": {
      "type": "string",
      "minLength": 1
    },
    "nome_canonico": {
      "type": "string",
      "minLength": 1
    },
    "classificacao": {
      "enum": [
        "ENTIDADE",
        "ATRIBUTO",
        "VALOR_OBJETO",
        "PAPEL",
        "ASSOCIACAO",
        "EVENTO",
        "ESTADO",
        "REGRA",
        "FATO_HISTORICO",
        "PROJECAO",
        "INDICADOR",
        "CATALOGO",
        "SNAPSHOT"
      ],
      "description": "União das três taxonomias-fonte, nenhuma delas se declarou substituta da outra: Fluxo de Modelagem Guia 1 §5, Fluxo de Modelagem Guia 2 §3.2, modelagem_dominio_dados.md §8."
    },
    "definicao": {
      "type": "string",
      "minLength": 1
    },
    "contexto_valido": {
      "type": [
        "string",
        "null"
      ]
    },
    "contexto_invalido": {
      "type": [
        "string",
        "null"
      ]
    },
    "inclusoes": {
      "type": "array",
      "items": {
        "type": "string"
      }
    },
    "exclusoes": {
      "type": "array",
      "items": {
        "type": "string"
      }
    },
    "sinonimos": {
      "type": "array",
      "items": {
        "type": "string"
      }
    },
    "termos_relacionados": {
      "type": "array",
      "items": {
        "type": "string"
      }
    },
    "fonte": {
      "type": "array",
      "items": {
        "type": "string",
        "pattern": "^EVD-[0-9]{4}$"
      },
      "minItems": 1,
      "description": "Fragmentos de evidência (EVD-NNNN, seção 4.5) que sustentam este termo — nunca AC-NNN bruto (um arquivo inteiro não é evidência de um conceito) nem só o nome do arquivo (melhoria a)."
    },
    "valores_permitidos": {
      "type": [
        "string",
        "null"
      ]
    },
    "temporalidade": {
      "type": [
        "string",
        "null"
      ]
    },
    "natureza_e_privacidade": {
      "type": [
        "string",
        "null"
      ]
    },
    "ativos_tecnicos": {
      "type": "array",
      "items": {
        "type": "string"
      }
    },
    "estado_epistemologico": {
      "enum": [
        "OBSERVADO",
        "INFERIDO",
        "AMBIGUO",
        "CONFLITANTE",
        "VALIDADO",
        "REJEITADO"
      ],
      "description": "modelagem_dominio_dados.md §17. Nunca promovido automaticamente para VALIDADO — exige autoridade humana adequada (ver evidencia.approval_evidence abaixo)."
    },
    "estado_tecnico": {
      "enum": [
        "NAO_MODELADO",
        "MODELADO",
        "IMPLEMENTADO",
        "TESTADO",
        "ATIVO",
        "SUBSTITUIDO"
      ],
      "description": "modelagem_dominio_dados.md §18 — dimensão separada do estado epistemológico ('VALIDADO ≠ IMPLEMENTADO'). Nesta fase só NAO_MODELADO/MODELADO são alcançáveis; IMPLEMENTADO/TESTADO/ATIVO pertencem ao modelo físico (fora de escopo, seção 3)."
    },
    "limitacoes": {
      "type": "array",
      "items": {
        "type": "string"
      }
    },
    "evidencia": {
      "type": "object",
      "description": "Quatro eixos separados — action_ref prova vínculo com uma ação versionada; não prova significado correto.",
      "required": [
        "source_evidence"
      ],
      "properties": {
        "source_evidence": {
          "type": "object",
          "required": [
            "comando_ou_metodo",
            "resultado"
          ],
          "properties": {
            "comando_ou_metodo": {
              "type": "string",
              "minLength": 1
            },
            "resultado": {
              "type": "string",
              "minLength": 1
            },
            "limitacoes": {
              "type": "array",
              "items": {
                "type": "string"
              }
            }
          }
        },
        "semantic_evidence": {
          "type": [
            "string",
            "null"
          ],
          "description": "Por que esta interpretação é a correta — o raciocínio, não só o método de extração."
        },
        "approval_evidence": {
          "type": "object",
          "properties": {
            "aprovador": {
              "type": "string",
              "enum": [
                "Davi Sermenho",
                "PENDENTE"
              ]
            },
            "data": {
              "type": [
                "string",
                "null"
              ],
              "format": "date"
            }
          }
        },
        "repository_evidence": {
          "type": "object",
          "properties": {
            "action_ref": {
              "type": "string",
              "pattern": "^(AC|SEM|SYN)-[0-9]{3}$"
            }
          }
        }
      }
    }
  },
  "allOf": [
    {
      "if": {
        "properties": {
          "estado_tecnico": {
            "enum": [
              "MODELADO",
              "IMPLEMENTADO",
              "TESTADO",
              "ATIVO",
              "SUBSTITUIDO"
            ]
          }
        }
      },
      "then": {
        "properties": {
          "estado_epistemologico": {
            "const": "VALIDADO"
          }
        }
      }
    },
    {
      "if": {
        "properties": {
          "estado_epistemologico": {
            "const": "VALIDADO"
          }
        }
      },
      "then": {
        "properties": {
          "evidencia": {
            "properties": {
              "semantic_evidence": {
                "type": "string",
                "minLength": 1
              },
              "approval_evidence": {
                "type": "object",
                "properties": {
                  "aprovador": {
                    "const": "Davi Sermenho"
                  },
                  "data": {
                    "type": "string",
                    "format": "date"
                  }
                },
                "required": [
                  "aprovador",
                  "data"
                ]
              },
              "repository_evidence": {
                "type": "object",
                "properties": {
                  "action_ref": {
                    "type": "string",
                    "pattern": "^(AC|SEM|SYN)-[0-9]{3}$"
                  }
                },
                "required": [
                  "action_ref"
                ]
              }
            },
            "required": [
              "semantic_evidence",
              "approval_evidence",
              "repository_evidence"
            ]
          }
        },
        "required": [
          "evidencia"
        ]
      }
    }
  ]
}
